<?xml version="1.0" encoding="UTF-8" ?>
<!DOCTYPE work44 SYSTEM "work44.dtd">

<work44>
    <x1>
        <a />
        <b />
        <a />
        <b />
    </x1>
    <x2>
        <a />
        <b />
        <b />
    </x2>
    <x3>
        <a />
        <a />
        <b />
    </x3>
    <x4>
        <a />
        <a />
        <a />
        <b />
    </x4>
</work44>